{
  "$schema": "https://json-schema.org/draft/2020-12/schema",
  "$id": "https://hcussatt.github.io/RH_Fever_Browser/schemas/game.schema.json",
  "title": "Rhythm Heaven browser game manifest v1",
  "type": "object",
  "additionalProperties": false,
  "required": ["schemaVersion", "id", "title", "action", "platform", "web", "wii"],
  "properties": {
    "$schema": {"type": "string"},
    "schemaVersion": {"const": 1},
    "id": {"type": "string", "pattern": "^[a-z][a-z0-9_-]{0,47}$"},
    "title": {"type": "string", "minLength": 1},
    "action": {"type": "string", "minLength": 1},
    "platform": {"const": "wii"},
    "web": {
      "type": "object", "additionalProperties": false, "required": ["enabled"],
      "properties": {
        "enabled": {"type": "boolean"},
        "order": {"type": "integer", "minimum": 0},
        "expectedCues": {"type": "integer", "minimum": 1},
        "icon": {"description": "Original game-select texture, imported locally from layout_gameSelect.szs.", "type": "string", "pattern": "^game_[0-9]{2}_[1-5]\\.00\\.tpl$"},
        "description": {"description": "Menu description for a game the original song select has none for.", "type": "string"},
        "iconArt": {
          "description": "For a game without an original game-select icon: one cell of its own converted cell animations over a colour the game uses, inside an original icon's frame (tools/extract-menu.py).",
          "type": "object", "additionalProperties": false, "required": ["bank", "background"],
          "properties": {
            "bank": {"type": "string"},
            "animation": {"type": "string"},
            "key": {"type": "integer", "minimum": 0},
            "cell": {"type": "integer", "minimum": 0},
            "crop": {"description": "Left, top, right, bottom as fractions of the cell's bounds.", "type": "array", "items": {"type": "number", "minimum": 0, "maximum": 1}, "minItems": 4, "maxItems": 4},
            "align": {"enum": ["center", "bottom"]},
            "padding": {"type": "integer", "minimum": 0},
            "offset": {"description": "Shift in icon pixels: right, down.", "type": "array", "items": {"type": "integer"}, "minItems": 2, "maxItems": 2},
            "scale": {"type": "number", "exclusiveMinimum": 0},
            "background": {"type": "object", "additionalProperties": false, "properties": {
              "color": {"type": "array", "items": {"type": "integer", "minimum": 0, "maximum": 255}, "minItems": 3, "maxItems": 3},
              "texture": {"description": "A converted texture in the game's assets folder; pixel picks the colour.", "type": "string"},
              "pixel": {"type": "array", "items": {"type": "integer", "minimum": 0}, "minItems": 2, "maxItems": 2}
            }}
          }
        }
      },
      "if": {"properties": {"enabled": {"const": true}}},
      "then": {"required": ["expectedCues"]}
    },
    "wii": {
      "type": "object", "additionalProperties": false,
      "required": ["projection", "endsWithMusic"],
      "oneOf": [
        {"required": ["scene", "cellanim", "units", "banks"], "not": {"anyOf": [{"required": ["music"]}, {"required": ["scenes"]}]}},
        {"required": ["music", "scenes"], "not": {"anyOf": [{"required": ["scene"]}, {"required": ["cellanim"]}, {"required": ["units"]}, {"required": ["banks"]}, {"required": ["layout"]}]}}
      ],
      "properties": {
        "scene": {"$ref": "#/$defs/name"},
        "sceneVariant": {"type": "integer", "minimum": 0},
        "input": {"description": "Input type the cues wait for (EInputType): 4 A (default), 6 A and B together.", "enum": [4, 6]},
        "cellanim": {"$ref": "#/$defs/discPath"},
        "units": {"type": "array", "minItems": 1, "uniqueItems": true, "items": {"$ref": "#/$defs/sourcePath"}},
        "banks": {"type": "array", "minItems": 1, "uniqueItems": true, "items": {"$ref": "#/$defs/name"}},
        "projection": {"type": "array", "minItems": 2, "maxItems": 2, "items": {"type": "integer", "minimum": 1}},
        "music": {"description": "A remix: the backing track (wave sound name) whose chart switches between scenes.", "$ref": "#/$defs/name"},
        "scenes": {
          "description": "A remix's scenes: each another manifest's game (its code, banks and profile), with the cellanim archive the remix version loads.",
          "type": "array", "minItems": 1,
          "items": {
            "type": "object", "additionalProperties": false, "required": ["game", "cellanim"],
            "properties": {"game": {"type": "string", "pattern": "^[a-z][a-z0-9_-]{0,47}$"}, "cellanim": {"$ref": "#/$defs/discPath"}}
          }
        },
        "epilogue": {"description": "The epilogue cell animation archive, when not beside the game's cellanim.", "$ref": "#/$defs/discPath"},
        "sceneOnly": {"description": "A scene only a remix changes to (Remix 10's navigator): it has no chart of its own, so it is never built or hosted on its own.", "const": true},
        "extraCellanims": {"description": "Other games' cellanim archives the scene also loads (the navigator's metronome); their banks join the scene's.", "type": "array", "items": {"$ref": "#/$defs/discPath"}},
        "results": {"description": "false: the game has no results screen or epilogue (Night Walk, the credits game, ends on the staff credits).", "const": false},
        "calibration": {
          "description": "The rhythm test: the browser measures the presses against the beats its signal sound plays on (SE_CHECK_CLICK, not the visual timer's zero) and saves them as the audio delay.",
          "type": "object", "additionalProperties": false, "required": ["signalSound"],
          "properties": {"signalSound": {"type": "integer", "minimum": 0}}
        },
        "practice": {"description": "false: the practice is left out (Night Walk's draws a night sky of its own that the port does not have yet).", "const": false},
        "perfectActive": {"type": "boolean"},
        "endsWithMusic": {"type": "boolean"},
        "messageLayout": {
          "description": "The game's own layout whose text boxes the chart's message panes use (Hole in One's CMyLayout, the lyric layout's lines in Cheer Readers); the shared speech balloon needs no entry.",
          "type": "object", "additionalProperties": false, "required": ["archive", "file"],
          "properties": {
            "archive": {"$ref": "#/$defs/discPath"},
            "file": {"type": "string", "pattern": "^[A-Za-z0-9_-]+\\.brlyt$"},
            "font": {"description": "Index of the layout's font its message text boxes use (default 0).", "type": "integer", "minimum": 0}
          }
        },
        "layout": {"$ref": "#/$defs/layout"},
        "lyricLayout": {"description": "The scene's lyric layout (CExScene +0x18) when the game's own layout is another (Night Walk's sky): the vocal song's title card.", "$ref": "#/$defs/layout"}
      }
    }
  },
  "$defs": {
    "layout": {
      "type": "object", "additionalProperties": false,
      "required": ["archive", "file", "animations", "startAtEnd", "texts", "panes"],
      "properties": {
        "archive": {"$ref": "#/$defs/discPath"},
        "file": {"type": "string", "pattern": "^[A-Za-z0-9_-]+\\.brlyt$"},
        "animations": {"description": "[pane, animation] bindings in the order the game's setup makes them; a third item may make the binding not recursive or stand for count numbered panes (a pane name with %02d).", "type": "array", "items": {"type": "array", "minItems": 2, "maxItems": 3, "prefixItems": [{"$ref": "#/$defs/paneName"}, {"$ref": "#/$defs/name"}, {"type": "object", "additionalProperties": false, "properties": {"recursive": {"const": false}, "count": {"type": "integer", "minimum": 1}}}]}},
        "startAtEnd": {"type": "array", "uniqueItems": true, "items": {"type": "integer", "minimum": 0}},
        "texts": {"type": "array", "uniqueItems": true, "items": {"$ref": "#/$defs/name"}},
        "panes": {"type": "array", "uniqueItems": true, "items": {"anyOf": [{"$ref": "#/$defs/name"}, {"description": "count numbered panes (a pane name with %02d)", "type": "array", "prefixItems": [{"$ref": "#/$defs/paneName"}, {"type": "integer", "minimum": 1}], "minItems": 2, "maxItems": 2}]}},
        "hidden": {"description": "Panes the game's layout setup hides.", "type": "array", "uniqueItems": true, "items": {"$ref": "#/$defs/name"}},
        "messages": {"description": "The messages its texts show: main (riq_E.bmg, the default) or bonus (riq_bonus_E.bmg, a vocal song's title card).", "enum": ["main", "bonus"]},
        "screen": {
          "description": "The layout is drawn only into the game's dynamic texture, shown by its screen bank (Shrimp Shuffle's shore); additive lists the panes whose alpha pass adds.",
          "type": "object", "additionalProperties": false, "required": ["additive"],
          "properties": {"additive": {"type": "array", "uniqueItems": true, "items": {"$ref": "#/$defs/name"}}}
        }
      }
    },
    "name": {"type": "string", "pattern": "^[A-Za-z_][A-Za-z0-9_]*$"},
    "paneName": {"type": "string", "pattern": "^[A-Za-z_][A-Za-z0-9_]*(?:%02d)?$"},
    "discPath": {"type": "string", "pattern": "^EN/(?:[A-Za-z0-9_-]+/)*[A-Za-z0-9_-]+\\.szs$"},
    "sourcePath": {"type": "string", "pattern": "^Game/(?:[A-Za-z0-9_-]+/)*[A-Za-z0-9_-]+\\.cpp$"}
  }
}
