{
  "$schema": "../../schemas/game.schema.json",
  "schemaVersion": 1,
  "id": "date2",
  "title": "Double Date 2",
  "action": "Kick",
  "platform": "wii",
  "wii": {
    "scene": "Date",
    "sceneVariant": 2,
    "cellanim": "EN/content2/cellanim/date/ver1/cellanim.szs",
    "units": [
      "Game/Date/SceneDate.cpp",
      "Game/Date/MyChecker.cpp",
      "Game/Date/MyFlow.cpp"
    ],
    "banks": [
      "w_date",
      "w_date_bg",
      "w_date_weasel",
      "w_date_sport"
    ],
    "projection": [
      832,
      456
    ],
    "endsWithMusic": true
  },
  "web": {
    "enabled": true,
    "expectedCues": 69,
    "icon": "game_08_4.00.tpl"
  }
}
