{
  "$schema": "../../schemas/game.schema.json",
  "schemaVersion": 1,
  "id": "tap",
  "title": "Tap Trial",
  "action": "Tap",
  "platform": "wii",
  "wii": {
    "scene": "AgbTap",
    "cellanim": "EN/content2/cellanim/agbTap/ver0/cellanim.szs",
    "units": [
      "Game/AgbTap/SceneAgbTap.cpp",
      "Game/AgbTap/MyChecker.cpp",
      "Game/AgbTap/MyFlow.cpp"
    ],
    "banks": [
      "agb_tap",
      "agb_tap_bg"
    ],
    "perfectActive": true,
    "projection": [
      832,
      456
    ],
    "endsWithMusic": true
  },
  "web": {
    "enabled": true,
    "order": 30,
    "expectedCues": 102
  }
}
