{
  "$schema": "../../schemas/game.schema.json",
  "schemaVersion": 1,
  "id": "navi",
  "title": "Navigator",
  "action": "Play",
  "platform": "wii",
  "wii": {
    "scene": "Navi",
    "sceneOnly": true,
    "cellanim": "EN/content2/cellanim/navi/ver0/cellanim.szs",
    "extraCellanims": [
      "EN/content2/cellanim/metronome/ver0/cellanim.szs"
    ],
    "units": [
      "Game/Navi/SceneNavi.cpp",
      "Game/Navi/MyChecker.cpp",
      "Game/Navi/MyFlow.cpp"
    ],
    "banks": [
      "navigator",
      "metronome"
    ],
    "projection": [
      832,
      456
    ],
    "endsWithMusic": true
  },
  "web": {
    "enabled": false
  }
}
