{
  "$schema": "../../schemas/game.schema.json",
  "schemaVersion": 1,
  "id": "rap2",
  "title": "Love Rap 2",
  "action": "Rap",
  "platform": "wii",
  "wii": {
    "scene": "Rap",
    "sceneVariant": 1,
    "cellanim": "EN/content2/cellanim/rap/ver1/cellanim.szs",
    "units": [
      "Game/Rap/SceneRap.cpp",
      "Game/Rap/MyChecker.cpp",
      "Game/Rap/MyFlow.cpp",
      "Game/Pseudo3D.cpp"
    ],
    "banks": [
      "rap",
      "rap_bg",
      "rap_bg_01",
      "rap_airplane",
      "rap_chandelier"
    ],
    "projection": [
      832,
      456
    ],
    "endsWithMusic": false,
    "layout": {
      "archive": "EN/content2/layout/layout_rap.szs",
      "file": "rap.brlyt",
      "animations": [
        [
          "N_message_00",
          "rap_show"
        ],
        [
          "N_miss_msg_00",
          "rap_show"
        ],
        [
          "N_message_01",
          "rap_show"
        ],
        [
          "N_message_02",
          "rap_show"
        ],
        [
          "N_message_00",
          "rap_hide"
        ],
        [
          "N_miss_msg_00",
          "rap_hide"
        ],
        [
          "N_message_01",
          "rap_hide"
        ],
        [
          "N_message_02",
          "rap_hide"
        ]
      ],
      "startAtEnd": [
        4,
        6,
        7
      ],
      "texts": [
        "T_message_00",
        "T_miss_msg_00",
        "T_message_01",
        "T_message_02"
      ],
      "panes": [
        "N_message_02"
      ]
    }
  },
  "web": {
    "enabled": true,
    "expectedCues": 48,
    "icon": "game_09_1.00.tpl"
  }
}
