{
  "$schema": "../../schemas/game.schema.json",
  "schemaVersion": 1,
  "id": "rocket",
  "title": "Launch Party",
  "action": "Launch",
  "platform": "wii",
  "wii": {
    "scene": "Rocket",
    "sceneVariant": 0,
    "cellanim": "EN/content2/cellanim/rocket/ver0/cellanim.szs",
    "units": [
      "Game/Rocket/SceneRocket.cpp",
      "Game/Rocket/MyChecker.cpp",
      "Game/Rocket/MyFlow.cpp",
      "Game/code_800D2920.cpp"
    ],
    "banks": [
      "rocket_00",
      "rocket_01",
      "rocket_02",
      "rocket_03",
      "rocket_bg"
    ],
    "projection": [
      854,
      480
    ],
    "endsWithMusic": true
  },
  "web": {
    "enabled": true,
    "expectedCues": 41
  }
}
